{
  "schema_version": "1.0",
  "updated_at": "2026-09-16T09:21:49Z",
  "timezone": "Asia/Macau",
  "repo": "https://github.com/samulee003/puiching-eclass-handoff",
  "rules": {
    "omit_advanced_subjects_for_li_yue": true,
    "li_xin_has_no_advanced_track": true,
    "pin_due_today_first": true,
    "include_no_submit_items": true,
    "close_loop_requires_parent_cleared_reply": true
  },
  "children": [
    {
      "id": "li-yue",
      "en": "Abigail",
      "zh": "李悅",
      "grade": "P3",
      "owner": "grok-liubei",
      "due_today": [
        {
          "subject": "中文",
          "title": "第3課習作",
          "due": "2026-09-15",
          "submit_required": true
        },
        {
          "subject": "數學",
          "title": "梁：習作6（p.14）",
          "due": "2026-09-15",
          "submit_required": true,
          "note": "完成習作第六課第14頁"
        },
        {
          "subject": "英文",
          "title": "(Ms. Au Ieong) Do Wb. p.14",
          "due": "2026-09-15",
          "submit_required": false,
          "note": "不用交，今日做"
        },
        {
          "subject": "英文",
          "title": "(Miss Valentina) Do Wb. p.16",
          "due": "2026-09-15",
          "submit_required": true
        }
      ],
      "due_soon": [
        {
          "subject": "數學",
          "title": "呂：周四交習作6",
          "due": "2026-09-16",
          "submit_required": true,
          "note": "先做按「邊」分類三角形；按「角」周三堂內完成"
        },
        {
          "subject": "英文",
          "title": "(Ms. Au Ieong) Do Wb. p.16",
          "due": "2026-09-16",
          "submit_required": true
        },
        {
          "subject": "英文",
          "title": "Correct Spelling Challenge / S.C. on Monday (List 2)",
          "due": "2026-09-20",
          "submit_required": true
        },
        {
          "subject": "中文",
          "title": "22/9前背第三課2、3段",
          "due": "2026-09-22",
          "submit_required": true
        }
      ],
      "tests_this_week": [
        {
          "subject": "英文",
          "title": "Quiz 1 on 17/9 (Thur)",
          "due": "2026-09-17",
          "submit_required": true,
          "detail": "Present Simple／Present Continuous／Past Tense（Worksheet 1–3）＋Reading Comprehension"
        }
      ],
      "other": [
        {
          "subject": "中文",
          "title": "第七周隨堂進行第一段口試（愛國愛澳）",
          "due": "2026-10-16",
          "submit_required": true,
          "detail": "3分鐘內；粵語／普通話；繪本／改編／自創"
        },
        {
          "subject": "中文",
          "title": "勤讀獎／閱讀卡（全年20張／週上限2）",
          "due": "2027-05-07",
          "submit_required": true,
          "progress": "0/20"
        }
      ],
      "cleared": false,
      "chrome_password_saved": true,
      "login_note": "家長帳 p21528136／李悅"
    },
    {
      "id": "li-xin",
      "en": "Gloria",
      "zh": "李昕",
      "grade": "P1",
      "owner": "grok-zhangfei",
      "due_today": [
        {
          "subject": "英文",
          "title": "Quiz Listening on 16/9 (Wed)：Numbers 1–20＋顏色認讀",
          "due": "2026-09-16",
          "submit_required": false,
          "note": "不用串字，只需認讀"
        }
      ],
      "due_soon": [
        {
          "subject": "常識",
          "title": "23/9(三)交閱讀工作紙一",
          "due": "2026-09-23",
          "submit_required": true
        },
        {
          "subject": "中文",
          "title": "默字一：温第1冊生字冊P.2–7",
          "due": "2026-09-23",
          "submit_required": false
        },
        {
          "subject": "常識",
          "title": "9/21–25 認讀評估第1課我的身體",
          "due": "2026-09-25",
          "submit_required": false
        }
      ],
      "other": [
        {
          "subject": "常識",
          "title": "生詞簿",
          "due": "2027-06-11",
          "submit_required": false
        },
        {
          "subject": "導師",
          "title": "內線 PDF",
          "due": "2027-07-02",
          "submit_required": false
        }
      ],
      "cleared": false,
      "chrome_password_saved": false,
      "tests_this_week": []
    }
  ],
  "scan_schedule_macau": {
    "weekday": [
      "10:50",
      "14:50",
      "18:20"
    ],
    "merge_report": [
      "11:00",
      "15:00",
      "18:30"
    ],
    "sunday": [],
    "chase": [],
    "paused": [
      "16:00",
      "17:30"
    ]
  },
  "ui": {
    "checkable": true,
    "storage": "localStorage",
    "close_loop": "paste 李悅清了 / 李昕清了 / 兩個清了 to Grok"
  },
  "rewards": {
    "points_per_task": 10,
    "all_done_bonus": 20,
    "note": "積分存孩子平板 localStorage；兌換需家長把實體零食交付才算完成",
    "catalog": [
      {
        "id": "gummy",
        "name": "小熊軟糖",
        "emoji": "🐻",
        "cost": 50
      },
      {
        "id": "choco",
        "name": "巧克力",
        "emoji": "🍫",
        "cost": 80
      },
      {
        "id": "chips",
        "name": "洋芋片",
        "emoji": "🥔",
        "cost": 120
      },
      {
        "id": "icecream",
        "name": "雪糕",
        "emoji": "🍦",
        "cost": 150
      }
    ]
  }
}
